"identifier","title","author","collections","description","topics","attribute:اللغة","files"
"bnr10039","التفسير والتأويل في القرآن","صلاح عبد الفتاح الخالدي","bnr","المقدمة  تمهيد التفسير الموضوعي ألوانه، وخطوات السير فيه   التفسير الموضوعي   ألوان التفسير الموضوعي الثلاثة   خطوات السير في التفسير الموضوعي   البدء بالتفسير والتأويل في القرآن  الفصل الأول التفسير والتأويل في اللغة والاصطلاح   المبحث الأول: التفسير في اللغة والاصطلاح   التفسير في اللغة   بين الفسر والسفر   تعريف «تفسير القرآن»   المبحث الثاني: التأويل في اللغة والاصطلاح   التأويل في اللغة   بين الأول والوأل   التأويل في الاصطلاح   معنيان للتأويل عند السلف   الفرق بين هذين المعنيين  الفصل الثاني التفسير والتأويل في الأسلوب القرآني   المبحث الأول: التفسير في الأسلوب القرآني   المبحث الثاني: التأويل في الأسلوب القرآني   المطلب الأول: مع التأويل في سورة يوسف   المطلب الثاني: مع التأويل في سورة الكهف   المطلب الثالث: مع التأويل في سورة الأعراف   المطلب الرابع: مع التأويل في سورة يونس   المطلب الخامس: مع التأويل في سورة الإسراء   المطلب السادس: مع التأويل في سورة النساء   المطلب السابع: مع التأويل في سورة آل عمران  الفصل الثالث التأويل في كلام الرسول وأصحابه   المبحث الأول: التأويل في الحديث النبوي   المطلب الأول: تأويل الرؤيا وتعبيرها   المطلب الثاني: التأويل بمعني الفهم والتفسير   المطلب الثالث: كيف كان رسول الله يتأول القرآن؟   المبحث الثاني: كيف كان الصحابة يتأولون القرآن؟  الفصل الرابع الفرق بين التفسير والتأويل   الفرق بين التفسير والتأويل   أشهر الأقوال في الفرق بين التفسير والتأويل   الراجح في الفرق بين التفسير والتأويل   المرحلة الأولي تفسير القرآن   المرحلة الثانية تأويل القرآن   وجوب تحقق التفسير والتأويل معا   الدليل علي هذه المرحلية   مع فهم الطبري للتأويل   التأويل بمعني الصرف والتحويل  الخاتمة ","الإسلام|الكتب المطبوعة","Arabic|English","bnr10039-1.pdf=الرابط المباشر 1  (للتحميل اضغط هنا)"
"bnr1004","فكر تصبح غنيا","نابليون هيل","bnr","يعد هذا الكتاب الأكثر تأثيراً في مجال التوجيه نحو تحقيق الإنجازات الشخصية والاستقلالية المالية، وأخيراً نحو الفن الروحي الذي لا يقاس بالمال. ويضم هذا الكتاب المعادلات التي تقود إلى النجاح للأشخاص الذين يرغبون بقوة في جمع المال والحصول على الرضى والغنى الروحيين الذين تحققهما الإنجازات والمكاسب. وإن كنت ممن ينشدون النصيحة في هذا المجال فإن هذا الكتاب يعلمك ماذا تفعل؟ وكيف تفعله؟ وسوف تجد فيه سحر التوجه الذاتي والتخطيط المنظم وخطط تفصيلية لتسويق خدماتك الشخصية والكثير من النصائح المستمدة من خبرات رجال عظام أثبتوا قيمتها. ","العلوم الاجتماعية|الكتب المطبوعة","Arabic|English","bnr1004-1.pdf=الرابط المباشر 1  (للتحميل اضغط هنا)"
"bnr10040","كونى كالزهزة -","دعاء عبدالرحمن","bnr","","العلوم الاجتماعية|الكتب المطبوعة","Arabic|English","bnr10040-1.pdf=الرابط المباشر 1  (للتحميل اضغط هنا)"
"bnr10041","قصة أصحاب الجنة","مصطفى العدوي","bnr","كتاب - قصة أصحاب الجنة - للمؤلف : مصطفى العدوي ","القرآن الكريم|الكتب المطبوعة","Arabic|English","bnr10041-1.pdf=الرابط المباشر 1  (للتحميل اضغط هنا)"
"bnr10042","لغة SQL للمبتدئين","الجامعة الافتراضية السورية/std:m.kaddar","bnr","كتاب اكاديمي يعلم لغة sql    بطريقة سهلة وممتعة. ","العلوم الكومبيوترية|الكتب المطبوعة","Arabic|English","bnr10042-1.pdf=الرابط المباشر 1  (للتحميل اضغط هنا)"
